Date	Title	Skills	Company / Institution	URL
Jan 2025 - Mar 2025	(Freelance) Assistant Data Scientist	AI/ML|CI/CD|Python|VS Code|AWS|Microsoft Copilot|Postman|RESTAPI	KAGURA Music Publication (Japan)	https://kagura-music.jp/melisma-top
Jul 2020 - Jul 2024	Quantitative Analyst	AI/ML|Data Viz|CI/CD|Python|C++|JavaScript|Eclipse|AWS|Google Cloud|RESTAPI|Shell Scripting	Sapiens Technologies Ltd	
Jan 2015 - Jun 2020	Associate (Software Developer)	Data Viz|Python|C++|SQL|Power BI|Eclipse|RESTAPI|Shell Scripting	Cash Algo Finance Group Ltd	https://www.cashalgo.com/
Aug 2010 - Dec 2014	Research Analyst	Data Viz|C++|SQL|R|VBA|VS Studio	Cash Dynamic Opportunities Investment Ltd	https://www.cfsg.com.hk/
Aug 2008 - Jul 2010	M. Phil, Mathematics	Data Viz|MATLAB	The Chinese University of Hong Kong	https://www.cuhk.edu.hk/english/index.html
Aug 2005 - Jul 2008	B. Sc., Mathematics	Data Viz|C++|R|MATLAB|VS Studio	The Chinese University of Hong Kong	https://www.cuhk.edu.hk/english/index.html
