Qualifications	Type	Topics	Skills	Credentials
Microsoft Certified: Fabric Data Engineer Associate	Certification	Data Engineering	Microsoft Fabric|PySpark	https://learn.microsoft.com/api/credentials/share/en-us/IsaacTai-0249/6725CCE7D72A2118
AWS Certified Machine Learning Engineer - Associate	Certification	ML/DL|Data Engineering|CI/CD	Amazon SageMaker|Apache Spark	https://www.credly.com/badges/17be3108-894f-46c6-b542-dd98eda81eef
Google Data Analytics Specialization	Specialization Course	Data Engineering|Data Viz	Python|R|Tableau	https://www.coursera.org/account/accomplishments/specialization/certificate/R51AJQCD51CH
Data Visualization with Tableau Tableau Specialization by <em>UC Davis</em>	Specialization Course	Data Viz	Tableau	https://www.coursera.org/account/accomplishments/specialization/certificate/JXN7F7B54S15
Google Cloud Data Analytics Certificate	Certificate	Data Viz	BigQuery	https://www.credly.com/badges/fa9b1520-f40c-4860-a81f-306750e8ff85
AWS Certified Solutions Architect – Associate	Certification	CI/CD		https://www.credly.com/badges/5fca6b0e-7a49-40f8-971f-0bb8fa4eb39a
